{
  "id": "default-game-stack",
  "description": "Default reusable kit stack for lightweight game prototypes.",
  "domains": [
    "foundation",
    "input",
    "spatial",
    "progression",
    "camera-feedback",
    "render-descriptors"
  ],
  "exports": {
    "package": "@luminarylabs/nexusengine-kits/default-game-stack",
    "cdn": "https://cdn.jsdelivr.net/gh/LuminaryLabs-Dev/NexusEngine-Kits@main/bundles/default-game-stack.js"
  }
}
